### ISSUE TITLE
2 out of 3 devices dropping connection in HA repeatedly

### ISSUE THREAD

**Issue by stoto** [danielkaldheim/ha_airstage#81]
I have 3 units configured in HA, but two of them is offline most of the time and only becomes available for 1-2 seconds. All 3 devices working nicely in airstage app. Wifi connection is very stable and signal is strong for all devices (checked in router). It is very strange because the "Office AC" is online and working well in HA all the time. All 3 devices and their sticks are exactly the same type.

![Image](https://github.com/user-attachments/assets/d204b6ef-4099-4149-8ba3-925618cbf2db)

![Image](https://github.com/user-attachments/assets/6a7aa159-779a-4e8d-8730-415e6e5bc405)

![Image](https://github.com/user-attachments/assets/7fbe87a6-2014-4502-bd13-2e9c8cf553cf)

19 June 2025 - Device Status Changes
10:12:38 (1 minute ago)

2C3B70000781 Indoor LED became unavailable
2C3B70000781 Quiet fan became unavailable
2C3B70000781 Powerful became unavailable
2C3B70000781 Economy mode became unavailable
2C3B70000781 Power became unavailable
Bedroom AC became unavailable

10:11:53 (2 minutes ago)

2C3B70000781 Indoor LED turned off
2C3B70000781 Quiet fan turned off
2C3B70000781 Powerful turned off
2C3B70000781 Economy mode turned off
2C3B70000781 Power turned off
Bedroom AC turned off

10:04:05 (10 minutes ago)

2C3B70000781 Indoor LED became unavailable
2C3B70000781 Quiet fan became unavailable
2C3B70000781 Powerful became unavailable
2C3B70000781 Economy mode became unavailable
2C3B70000781 Power became unavailable
Bedroom AC became unavailable triggered by action Climate: Set fan mode - Stoto

10:03:51 (10 minutes ago)

2C3B70000781 Indoor LED turned off
2C3B70000781 Quiet fan turned on
2C3B70000781 Powerful turned off
2C3B70000781 Economy mode turned off
2C3B70000781 Power turned off
Bedroom AC turned off

09:57:33 (17 minutes ago)

2C3B70000781 Indoor LED became unavailable
2C3B70000781 Quiet fan became unavailable

**Comment by ohshazbot** [comment]
What version are you running?

**Comment by stoto** [comment]
Based on this, it's 1.4.4

![Image](https://github.com/user-attachments/assets/26177674-580d-458e-8f1a-9e5a83acbb0c)
![Image](https://github.com/user-attachments/assets/740f842b-c6c2-40ee-9739-6470bbb3f1e6)

![Image](https://github.com/user-attachments/assets/a8831388-f546-4bb6-a56f-b687927b4c3f)

**Comment by ohshazbot** [comment]
Out of curiosity, what's the general health of your wifi in the rooms where it struggles? Initial reading makes me think this is a local network issue (could also be a device issue as sometimes my dongles become unresponsive). Otherwise something you can do, if your proficient enough, is to try to hit the endpoints for the devices yourself via curl while they're in an inactive state to see if you can repro it (in which case it's a device issue).

`curl --no-progress-meter -X GET --data '{"device_id":"DEVICE_ID","device_sub_id":0,"req_id":"","modified_by":"","set_level":"03","list":["iu_fan_spd", "af_vertical_num_dir","iu_wifi_led","iu_af_inc_hrz","iu_af_inc_vrt","iu_indoor_tmp","iu_outdoor_tmp","iu_hmn_det"]}' 'http://IP_ADDRESS/GetParam'`
Just make sure to sub in IP_ADDRESS and DEVICE_ID (device id must be all caps)

**Comment by stoto** [comment]
That curl gives back the following response without error:
{"value":{"iu_fan_spd":"2","iu_wifi_led":"0","iu_af_inc_hrz":"0","iu_af_inc_vrt":"4","iu_indoor_tmp":"7150","iu_outdoor_tmp":"7200","iu_hmn_det":"0"},"read_res":"ack","device_id":"DEVICEID","device_sub_id":0,"req_id":"","modified_by":"","set_level":"03","cause":"","result":"OK","error":""}

Using that curl I quickly vibe coded a polling bash script to fetch all 3 devices with 5 seconds repeat. Ran it for 3 minutes and all calls were successful.

Where can I find some more detailed logs from the integration?

`
=== Poll Cycle: 2025-06-25 22:23:06 ===
✓ Device_40 - HTTP 200 - Duration: 0s
✓ Device_23 - HTTP 200 - Duration: 1s
✓ Device_24 - HTTP 200 - Duration: 1s

Summary: 3/3 endpoints responding successfully

=== Poll Cycle: 2025-06-25 22:23:13 ===
✓ Device_40 - HTTP 200 - Duration: 0s
✓ Device_23 - HTTP 200 - Duration: 1s
✓ Device_24 - HTTP 200 - Duration: 1s

Summary: 3/3 endpoints responding successfully

=== Poll Cycle: 2025-06-25 22:23:20 ===
✓ Device_40 - HTTP 200 - Duration: 0s
✓ Device_23 - HTTP 200 - Duration: 1s
✓ Device_24 - HTTP 200 - Duration: 1s

Summary: 3/3 endpoints responding successfully

=== Poll Cycle: 2025-06-25 22:23:27 ===
✓ Device_40 - HTTP 200 - Duration: 1s
✓ Device_23 - HTTP 200 - Duration: 1s
✓ Device_24 - HTTP 200 - Duration: 0s

Summary: 3/3 endpoints responding successfully

=== Poll Cycle: 2025-06-25 22:23:34 ===
✓ Device_40 - HTTP 200 - Duration: 0s
✓ Device_23 - HTTP 200 - Duration: 1s
✓ Device_24 - HTTP 200 - Duration: 1s

Summary: 3/3 endpoints responding successfully

=== Poll Cycle: 2025-06-25 22:23:42 ===
✓ Device_40 - HTTP 200 - Duration: 0s
✓ Device_23 - HTTP 200 - Duration: 1s
✓ Device_24 - HTTP 200 - Duration: 1s

Summary: 3/3 endpoints responding successfully

=== Poll Cycle: 2025-06-25 22:23:49 ===
✓ Device_40 - HTTP 200 - Duration: 0s
✓ Device_23 - HTTP 200 - Duration: 1s
✓ Device_24 - HTTP 200 - Duration: 0s

Summary: 3/3 endpoints responding successfully

=== Poll Cycle: 2025-06-25 22:23:55 ===
✓ Device_40 - HTTP 200 - Duration: 1s
✓ Device_23 - HTTP 200 - Duration: 1s
✓ Device_24 - HTTP 200 - Duration: 0s

Summary: 3/3 endpoints responding successfully

=== Poll Cycle: 2025-06-25 22:24:02 ===
✓ Device_40 - HTTP 200 - Duration: 1s
✓ Device_23 - HTTP 200 - Duration: 0s
✓ Device_24 - HTTP 200 - Duration: 1s

Summary: 3/3 endpoints responding successfully

=== Poll Cycle: 2025-06-25 22:24:09 ===
✓ Device_40 - HTTP 200 - Duration: 1s
✓ Device_23 - HTTP 200 - Duration: 0s
✓ Device_24 - HTTP 200 - Duration: 1s

Summary: 3/3 endpoints responding successfully

=== Poll Cycle: 2025-06-25 22:24:16 ===
✓ Device_40 - HTTP 200 - Duration: 1s
✓ Device_23 - HTTP 200 - Duration: 1s
✓ Device_24 - HTTP 200 - Duration: 0s

Summary: 3/3 endpoints responding successfully

=== Poll Cycle: 2025-06-25 22:24:23 ===
✓ Device_40 - HTTP 200 - Duration: 1s
✓ Device_23 - HTTP 200 - Duration: 1s
✓ Device_24 - HTTP 200 - Duration: 0s

Summary: 3/3 endpoints responding successfully

=== Poll Cycle: 2025-06-25 22:24:30 ===
✓ Device_40 - HTTP 200 - Duration: 1s
✓ Device_23 - HTTP 200 - Duration: 0s
✓ Device_24 - HTTP 200 - Duration: 1s

Summary: 3/3 endpoints responding successfully

=== Poll Cycle: 2025-06-25 22:24:37 ===
✓ Device_40 - HTTP 200 - Duration: 1s
✓ Device_23 - HTTP 200 - Duration: 0s
✓ Device_24 - HTTP 200 - Duration: 1s

Summary: 3/3 endpoints responding successfully

=== Poll Cycle: 2025-06-25 22:24:44 ===
✓ Device_40 - HTTP 200 - Duration: 1s
✓ Device_23 - HTTP 200 - Duration: 0s
✓ Device_24 - HTTP 200 - Duration: 1s

Summary: 3/3 endpoints responding successfully

=== Poll Cycle: 2025-06-25 22:24:51 ===
✓ Device_40 - HTTP 200 - Duration: 0s
✓ Device_23 - HTTP 200 - Duration: 1s
✓ Device_24 - HTTP 200 - Duration: 1s

Summary: 3/3 endpoints responding successfully

=== Poll Cycle: 2025-06-25 22:24:58 ===
✓ Device_40 - HTTP 200 - Duration: 2s
✓ Device_23 - HTTP 200 - Duration: 1s
✓ Device_24 - HTTP 200 - Duration: 1s

Summary: 3/3 endpoints responding successfully

=== Poll Cycle: 2025-06-25 22:25:07 ===
✓ Device_40 - HTTP 200 - Duration: 0s
✓ Device_23 - HTTP 200 - Duration: 1s
✓ Device_24 - HTTP 200 - Duration: 1s

Summary: 3/3 endpoints responding successfully

=== Poll Cycle: 2025-06-25 22:25:14 ===
✓ Device_40 - HTTP 200 - Duration: 0s
✓ Device_23 - HTTP 200 - Duration: 1s
✓ Device_24 - HTTP 200 - Duration: 0s

Summary: 3/3 endpoints responding successfully

=== Poll Cycle: 2025-06-25 22:25:20 ===
✓ Device_40 - HTTP 200 - Duration: 2s
✓ Device_23 - HTTP 200 - Duration: 1s
✓ Device_24 - HTTP 200 - Duration: 1s

Summary: 3/3 endpoints responding successfully

=== Poll Cycle: 2025-06-25 22:25:29 ===
✓ Device_40 - HTTP 200 - Duration: 0s
✓ Device_23 - HTTP 200 - Duration: 1s
✓ Device_24 - HTTP 200 - Duration: 0s

Summary: 3/3 endpoints responding successfully

=== Poll Cycle: 2025-06-25 22:25:35 ===
✓ Device_40 - HTTP 200 - Duration: 1s
✓ Device_23 - HTTP 200 - Duration: 0s
✓ Device_24 - HTTP 200 - Duration: 1s

Summary: 3/3 endpoints responding successfully

=== Poll Cycle: 2025-06-25 22:25:42 ===
✓ Device_40 - HTTP 200 - Duration: 1s
✓ Device_23 - HTTP 200 - Duration: 0s
✓ Device_24 - HTTP 200 - Duration: 1s`

**Comment by ohshazbot** [comment]
During that time, was HA reporting the devices as unavailable?

**Comment by stoto** [comment]
Yes.

**Comment by firerm** [comment]
That’s exactly the same problem I have with the same air conditioner (I just saw the issue), and it’s exactly the same model I own — the only difference is that I have just one unit.

**Comment by ohshazbot** [comment]
Well, I caught a tcpdump of a drop (at 03:37):

```
03:08:02.600089 IP nuc.lan.53458 > 192.168.86.67.http: Flags [S], seq 1221870988, win 64240, options [mss 1460,sackOK,TS val 1275275332 ecr 0,nop,wscale 7], length 0
03:08:02.603580 IP 192.168.86.67.http > nuc.lan.53458: Flags [S.], seq 3490300206, ack 1221870989, win 7300, options [mss 1460], length 0
03:08:02.603669 IP nuc.lan.53458 > 192.168.86.67.http: Flags [.], ack 1, win 64240, length 0
03:08:02.604657 IP nuc.lan.53458 > 192.168.86.67.http: Flags [P.], seq 1:411, ack 1, win 64240, length 410: HTTP: POST /GetParam HTTP/1.1
03:08:02.617428 IP 192.168.86.67.http > nuc.lan.53458: Flags [.], ack 411, win 6890, length 0
03:08:03.388996 IP 192.168.86.67.http > nuc.lan.53458: Flags [P.], seq 1:73, ack 411, win 6890, length 72: HTTP: HTTP/1.1 200 OK
03:08:03.389068 IP nuc.lan.53458 > 192.168.86.67.http: Flags [.], ack 73, win 64168, length 0
03:08:03.390750 IP 192.168.86.67.http > nuc.lan.53458: Flags [FP.], seq 73:340, ack 411, win 6890, length 267: HTTP
03:08:03.391705 IP nuc.lan.53458 > 192.168.86.67.http: Flags [F.], seq 411, ack 341, win 63900, length 0
03:08:03.398406 IP 192.168.86.67.http > nuc.lan.53458: Flags [.], ack 412, win 6889, length 0
03:08:04.392509 IP nuc.lan.53474 > 192.168.86.67.http: Flags [S], seq 547259136, win 64240, options [mss 1460,sackOK,TS val 1275277124 ecr 0,nop,wscale 7], length 0
03:08:04.396605 IP 192.168.86.67.http > nuc.lan.53474: Flags [S.], seq 3491080083, ack 547259137, win 7300, options [mss 1460], length 0
03:08:04.396681 IP nuc.lan.53474 > 192.168.86.67.http: Flags [.], ack 1, win 64240, length 0
03:08:04.397294 IP nuc.lan.53474 > 192.168.86.67.http: Flags [P.], seq 1:636, ack 1, win 64240, length 635: HTTP: POST /GetParam HTTP/1.1
03:08:04.612589 IP nuc.lan.53474 > 192.168.86.67.http: Flags [P.], seq 1:636, ack 1, win 64240, length 635: HTTP: POST /GetParam HTTP/1.1
03:08:04.618248 IP 192.168.86.67.http > nuc.lan.53474: Flags [.], ack 636, win 6665, length 0
03:08:04.619091 IP 192.168.86.67.http > nuc.lan.53474: Flags [.], ack 636, win 6665, length 0
03:08:05.142006 IP 192.168.86.67.http > nuc.lan.53474: Flags [P.], seq 1:73, ack 636, win 6665, length 72: HTTP: HTTP/1.1 200 OK
03:08:05.142094 IP nuc.lan.53474 > 192.168.86.67.http: Flags [.], ack 73, win 64168, length 0
03:08:05.143007 IP 192.168.86.67.http > nuc.lan.53474: Flags [FP.], seq 73:609, ack 636, win 6665, length 536: HTTP
03:08:05.143271 IP nuc.lan.53474 > 192.168.86.67.http: Flags [.], ack 610, win 63784, length 0
03:08:05.148815 IP nuc.lan.53474 > 192.168.86.67.http: Flags [F.], seq 636, ack 610, win 63784, length 0
03:08:05.158679 IP 192.168.86.67.http > nuc.lan.53474: Flags [.], ack 637, win 6664, length 0
03:08:14.599973 IP nuc.lan.59246 > 192.168.86.67.http: Flags [S], seq 2536069210, win 64240, options [mss 1460,sackOK,TS val 1275287332 ecr 0,nop,wscale 7], length 0
03:08:14.602566 IP 192.168.86.67.http > nuc.lan.59246: Flags [S.], seq 3491859980, ack 2536069211, win 7300, options [mss 1460], length 0
03:08:14.602666 IP nuc.lan.59246 > 192.168.86.67.http: Flags [.], ack 1, win 64240, length 0
03:08:14.603664 IP nuc.lan.59246 > 192.168.86.67.http: Flags [P.], seq 1:411, ack 1, win 64240, length 410: HTTP: POST /GetParam HTTP/1.1
03:08:14.630587 IP 192.168.86.67.http > nuc.lan.59246: Flags [.], ack 411, win 6890, length 0
03:08:15.314840 IP 192.168.86.67.http > nuc.lan.59246: Flags [P.], seq 1:73, ack 411, win 6890, length 72: HTTP: HTTP/1.1 200 OK
03:08:15.314925 IP nuc.lan.59246 > 192.168.86.67.http: Flags [.], ack 73, win 64168, length 0
03:08:15.316685 IP 192.168.86.67.http > nuc.lan.59246: Flags [FP.], seq 73:340, ack 411, win 6890, length 267: HTTP
03:08:15.317606 IP nuc.lan.59246 > 192.168.86.67.http: Flags [F.], seq 411, ack 341, win 63900, length 0
03:08:15.319927 IP 192.168.86.67.http > nuc.lan.59246: Flags [.], ack 412, win 6889, length 0
03:08:16.318667 IP nuc.lan.59254 > 192.168.86.67.http: Flags [S], seq 1535410603, win 64240, options [mss 1460,sackOK,TS val 1275289051 ecr 0,nop,wscale 7], length 0
03:08:16.322551 IP 192.168.86.67.http > nuc.lan.59254: Flags [S.], seq 3492639881, ack 1535410604, win 7300, options [mss 1460], length 0
03:08:16.322651 IP nuc.lan.59254 > 192.168.86.67.http: Flags [.], ack 1, win 64240, length 0
03:08:16.323636 IP nuc.lan.59254 > 192.168.86.67.http: Flags [P.], seq 1:636, ack 1, win 64240, length 635: HTTP: POST /GetParam HTTP/1.1
03:08:16.380633 IP 192.168.86.67.http > nuc.lan.59254: Flags [.], ack 636, win 6665, length 0
03:08:16.770393 IP 192.168.86.67.http > nuc.lan.59254: Flags [P.], seq 1:73, ack 636, win 6665, length 72: HTTP: HTTP/1.1 200 OK
03:08:16.770433 IP nuc.lan.59254 > 192.168.86.67.http: Flags [.], ack 73, win 64168, length 0
03:08:16.771984 IP 192.168.86.67.http > nuc.lan.59254: Flags [FP.], seq 73:609, ack 636, win 6665, length 536: HTTP
03:08:16.772357 IP nuc.lan.59254 > 192.168.86.67.http: Flags [.], ack 610, win 63784, length 0
03:08:16.777562 IP nuc.lan.59254 > 192.168.86.67.http: Flags [F.], seq 636, ack 610, win 63784, length 0
03:08:16.782946 IP 192.168.86.67.http > nuc.lan.59254: Flags [.], ack 637, win 6664, length 0
03:08:26.599455 IP nuc.lan.43862 > 192.168.86.67.http: Flags [S], seq 4000293820, win 64240, options [mss 1460,sackOK,TS val 1275299331 ecr 0,nop,wscale 7], length 0
03:08:26.602581 IP 192.168.86.67.http > nuc.lan.43862: Flags [S.], seq 3493419802, ack 4000293821, win 7300, options [mss 1460], length 0
03:08:26.602684 IP nuc.lan.43862 > 192.168.86.67.http: Flags [.], ack 1, win 64240, length 0
03:08:26.603669 IP nuc.lan.43862 > 192.168.86.67.http: Flags [P.], seq 1:411, ack 1, win 64240, length 410: HTTP: POST /GetParam HTTP/1.1
03:08:26.630618 IP 192.168.86.67.http > nuc.lan.43862: Flags [.], ack 411, win 6890, length 0
03:08:27.563710 IP 192.168.86.67.http > nuc.lan.43862: Flags [P.], seq 1:73, ack 411, win 6890, length 72: HTTP: HTTP/1.1 200 OK
03:08:27.563800 IP nuc.lan.43862 > 192.168.86.67.http: Flags [.], ack 73, win 64168, length 0
03:08:27.564483 IP 192.168.86.67.http > nuc.lan.43862: Flags [FP.], seq 73:340, ack 411, win 6890, length 267: HTTP
03:08:27.565220 IP nuc.lan.43862 > 192.168.86.67.http: Flags [F.], seq 411, ack 341, win 63900, length 0
03:08:27.569857 IP 192.168.86.67.http > nuc.lan.43862: Flags [.], ack 412, win 6889, length 0
03:08:28.566889 IP nuc.lan.59288 > 192.168.86.67.http: Flags [S], seq 2799801178, win 64240, options [mss 1460,sackOK,TS val 1275301299 ecr 0,nop,wscale 7], length 0
03:08:28.573743 IP 192.168.86.67.http > nuc.lan.59288: Flags [S.], seq 3494199727, ack 2799801179, win 7300, options [mss 1460], length 0
03:08:28.573845 IP nuc.lan.59288 > 192.168.86.67.http: Flags [.], ack 1, win 64240, length 0
03:08:28.574851 IP nuc.lan.59288 > 192.168.86.67.http: Flags [P.], seq 1:636, ack 1, win 64240, length 635: HTTP: POST /GetParam HTTP/1.1
03:08:28.630677 IP 192.168.86.67.http > nuc.lan.59288: Flags [.], ack 636, win 6665, length 0
03:08:29.020931 IP 192.168.86.67.http > nuc.lan.59288: Flags [P.], seq 1:73, ack 636, win 6665, length 72: HTTP: HTTP/1.1 200 OK
03:08:29.020974 IP nuc.lan.59288 > 192.168.86.67.http: Flags [.], ack 73, win 64168, length 0
03:08:29.022076 IP 192.168.86.67.http > nuc.lan.59288: Flags [FP.], seq 73:609, ack 636, win 6665, length 536: HTTP
03:08:29.022154 IP nuc.lan.59288 > 192.168.86.67.http: Flags [.], ack 610, win 63784, length 0
03:08:29.024759 IP nuc.lan.59288 > 192.168.86.67.http: Flags [F.], seq 636, ack 610, win 63784, length 0
03:08:29.027021 IP 192.168.86.67.http > nuc.lan.59288: Flags [.], ack 637, win 6664, length 0
03:08:38.599617 IP nuc.lan.53030 > 192.168.86.67.http: Flags [S], seq 44435459, win 64240, options [mss 1460,sackOK,TS val 1275311332 ecr 0,nop,wscale 7], length 0
03:08:38.605692 IP 192.168.86.67.http > nuc.lan.53030: Flags [S.], seq 3494979672, ack 44435460, win 7300, options [mss 1460], length 0
03:08:38.605782 IP nuc.lan.53030 > 192.168.86.67.http: Flags [.], ack 1, win 64240, length 0
03:08:38.606808 IP nuc.lan.53030 > 192.168.86.67.http: Flags [P.], seq 1:411, ack 1, win 64240, length 410: HTTP: POST /GetParam HTTP/1.1
03:08:38.630826 IP 192.168.86.67.http > nuc.lan.53030: Flags [.], ack 411, win 6890, length 0
03:08:39.430019 IP 192.168.86.67.http > nuc.lan.53030: Flags [P.], seq 1:73, ack 411, win 6890, length 72: HTTP: HTTP/1.1 200 OK
03:08:39.430112 IP nuc.lan.53030 > 192.168.86.67.http: Flags [.], ack 73, win 64168, length 0
03:08:39.430892 IP 192.168.86.67.http > nuc.lan.53030: Flags [FP.], seq 73:340, ack 411, win 6890, length 267: HTTP
03:08:39.431713 IP nuc.lan.53030 > 192.168.86.67.http: Flags [F.], seq 411, ack 341, win 63900, length 0
03:08:39.434051 IP 192.168.86.67.http > nuc.lan.53030: Flags [.], ack 412, win 6889, length 0
03:08:40.433148 IP nuc.lan.53042 > 192.168.86.67.http: Flags [S], seq 859225602, win 64240, options [mss 1460,sackOK,TS val 1275313165 ecr 0,nop,wscale 7], length 0
03:08:40.435728 IP 192.168.86.67.http > nuc.lan.53042: Flags [S.], seq 3495759621, ack 859225603, win 7300, options [mss 1460], length 0
03:08:40.435804 IP nuc.lan.53042 > 192.168.86.67.http: Flags [.], ack 1, win 64240, length 0
03:08:40.436813 IP nuc.lan.53042 > 192.168.86.67.http: Flags [P.], seq 1:636, ack 1, win 64240, length 635: HTTP: POST /GetParam HTTP/1.1
03:08:40.630824 IP 192.168.86.67.http > nuc.lan.53042: Flags [.], ack 636, win 6665, length 0
03:08:41.175975 IP 192.168.86.67.http > nuc.lan.53042: Flags [P.], seq 1:73, ack 636, win 6665, length 72: HTTP: HTTP/1.1 200 OK
03:08:41.176048 IP nuc.lan.53042 > 192.168.86.67.http: Flags [.], ack 73, win 64168, length 0
03:08:41.178078 IP 192.168.86.67.http > nuc.lan.53042: Flags [FP.], seq 73:609, ack 636, win 6665, length 536: HTTP
03:08:41.178345 IP nuc.lan.53042 > 192.168.86.67.http: Flags [.], ack 610, win 63784, length 0
03:08:41.183458 IP nuc.lan.53042 > 192.168.86.67.http: Flags [F.], seq 636, ack 610, win 63784, length 0
03:08:41.185823 IP 192.168.86.67.http > nuc.lan.53042: Flags [.], ack 637, win 6664, length 0
```

With the current code structure, it manifested as an aiohttp timeout (which is a 20s total timeout).
